links,titles,pubdates,content,html_file_names
https://news.hangzhou.com.cn/gnxw/content/2021-10/24/content_8079424.htm,新疆是个好地方视频交流会在土耳其举办杭州网,2021-10-24--07-46-35,人民日报安卡拉10月23日电（记者王传宝）22日，中国驻土耳其大使馆在安卡拉与新疆<b>维吾尔</b>自治区政府在乌鲁木齐共同举办“新疆是个好地方”视频交流会。,新疆是个好地方视频交流会在土耳其举办杭州---2021-10-24--07-46-35.html
http://www.workercn.cn/34165/202110/24/211024132816819.shtml,新疆乌苏市让户外劳动者路边有了家,2021-10-24--05-40-45,近日，新疆<b>维吾尔</b>自治区塔城地区乌苏市“饿了么”送餐员刘杰深有感触地说。 据了解，截至目前，乌苏市总工会已建成并投入使用的有3个户外劳动者服务站点。,新疆乌苏市让户外劳动者路边有了家---2021-10-24--05-40-45.html
http://www.chinanews.com/gn/2021/10-24/9593789.shtml,新疆是个好地方视频交流会在土耳其举办中国新闻网,2021-10-24--04-52-01,(记者王传宝)22日，中国驻土耳其大使馆在安卡拉与新疆<b>维吾尔</b>自治区政府在乌鲁木齐共同举办“新疆是个好地方”视频交流会。在线出席视频交流会的土耳其大国民&nbsp;...,新疆是个好地方视频交流会在土耳其举办中国---2021-10-24--04-52-01.html
http://www.wxrb.com/doc/2021/10/24/124280.shtml,新疆是个好地方视频交流会在土耳其举办无锡日报,2021-10-24--04-06-43,本报安卡拉10月23日电（记者王传宝）22日，中国驻土耳其大使馆在安卡拉与新疆<b>维吾尔</b>自治区政府在乌鲁木齐共同举办“新疆是个好地方”视频交流会。,新疆是个好地方视频交流会在土耳其举办无锡---2021-10-24--04-06-43.html
https://news.hangzhou.com.cn/gnxw/content/2021-10/24/content_8079427.htm,曲终人不散期待明年再见对口援疆19省市非物质文化遗产展圆满落幕杭州网,2021-10-24--03-26-09,非物质文化遗产——新疆<b>维吾尔</b>木卡姆在非遗展上精彩演出（薛玲摄）. 列入联合国教科文组织的非物质文化遗产项目——新疆史诗《玛纳斯》亮相非遗展（张丽萍摄）.,曲终人不散期待明年再见对口援疆19省市非---2021-10-24--03-26-09.html
https://ha.huatu.com/zt/gkzw/2022md/content/125331_300110001003.html,新疆维吾尔自治区消防救援总队石河子市支队管理指挥岗位2022国考面试名单及分数线河南华图,2021-10-24--02-25-19,2022国家公务员面试名单提供2022年国家公务员面试名单及面试分数线新疆<b>维吾尔</b>自治区消防救援总队-新疆消防救援总队所属消防救援支队-新疆<b>维吾尔</b>自治区消防&nbsp;...,新疆维吾尔自治区消防救援总队石河子市支队---2021-10-24--02-25-19.html
https://finance.sina.com.cn/tech/2021-10-23/doc-iktzscyy1391229.shtml,中国驻土使馆与新疆举办新疆是个好地方视频交流会新浪财经,2021-10-24--01-49-19,新疆<b>维吾尔</b>自治区人大常委会主任肖开提·依明通过视频连线发表讲话，全面介绍了新疆近年来的发展成就，表示新疆经济社会发展和民生改善取得了前所未有的&nbsp;...,中国驻土使馆与新疆举办新疆是个好地方视频---2021-10-24--01-49-19.html
https://m.nbd.com.cn/articles/2021-10-23/1958525.html,西部牧业公司财务核算已使用金蝶系统每日经济新闻,2021-10-24--01-46-11,畜禽养殖 新疆<b>维吾尔</b>自治区 西部牧业 -1.1%. 每经AI快讯，有投资者在投资者互动平台提问：董秘您好！ 公司很早已和金蝶软件合作数字化管理，请问目前进展&nbsp;...,西部牧业公司财务核算已使用金蝶系统每日经---2021-10-24--01-46-11.html
http://cpc.people.com.cn/n1/2021/1024/c64387-32262346.html,新疆是个好地方视频交流会在土耳其举办中国共产党新闻网,2021-10-24--00-55-46,本报安卡拉10月23日电 （记者王传宝）22日，中国驻土耳其大使馆在安卡拉与新疆<b>维吾尔</b>自治区政府在乌鲁木齐共同举办“新疆是个好地方”视频交流会。,新疆是个好地方视频交流会在土耳其举办中国---2021-10-24--00-55-46.html
http://www.faxin.cn/lib/dffl/DfflSimple.aspx?gid=B1074508&libid=,新疆维吾尔自治区人力资源和社会保障厅新疆生产建设兵团公安局法信,2021-10-24--00-15-47,新疆<b>维吾尔</b>自治区教育厅、新疆<b>维吾尔</b>自治区发展和改革委员会、新疆<b>维吾尔</b>自治区公安厅、新疆<b>维吾尔</b>自治区财政厅、新疆<b>维吾尔</b>自治区人力资源和社会保障厅、&nbsp;...,新疆维吾尔自治区人力资源和社会保障厅新疆---2021-10-24--00-15-47.html
https://m.nbd.com.cn/articles/2021-10-23/1958475.html,西部牧业公司下属乳制品加工厂及饲料加工厂均拥有完善的供暖设施每日经济新闻,2021-10-23--22-54-27,西部牧业：公司下属乳制品加工厂及饲料加工厂均拥有完善的供暖设施. 每日经济新闻 2021-10-23 18:32. 畜禽养殖 新疆<b>维吾尔</b>自治区 西部牧业 -1.1%.,西部牧业公司下属乳制品加工厂及饲料加工厂---2021-10-23--22-54-27.html
http://czt.xinjiang.gov.cn/czt/zcwj/zfxxgk_gknrz_5.shtml,政策文件及解读_新疆维吾尔自治区财政厅,2021-10-23--22-43-17,政策文件及解读: 关于对调整优化节能产品、环境标志产品政府采购执行机制政策的解读 2019-11-08: 《关于印发〈新疆<b>维吾尔</b>自治区林业改革发展资金管理实施&nbsp;...,政策文件及解读_新疆维吾尔自治区财政厅---2021-10-23--22-43-17.html
http://czt.xinjiang.gov.cn/czt/zcwj/202010/a156bd3ffb3d44a782593d80bac51770.shtml,关于印发新疆维吾尔自治区20212022年度政府集中采购目录及标准的通知及解读_政策,2021-10-23--21-26-22,为贯彻落实深化政府采购制度改革，根据财政部《地方预算单位政府集中采购目录及标准指引（2020年版）》（财库〔2019〕69号）有关要求，我们制定了《新疆<b>维吾尔</b>&nbsp;...,关于印发新疆维吾尔自治区20212022---2021-10-23--21-26-22.html
http://liuyan.people.com.cn/threads/content?tid=11694808,小商品城来回乌鲁木齐上班检查站新疆维吾尔自治区党委书记陈全国领导留言板,2021-10-23--18-07-52,我们经常上班迟到被罚钱2现在如今，新的检查站建设，导致每天早上早高峰，排队长耽误时间. 新疆<b>维吾尔</b>自治区五家渠市五家渠市青联西街.,小商品城来回乌鲁木齐上班检查站新疆维吾尔---2021-10-23--18-07-52.html
http://liuyan.people.com.cn/threads/content?tid=11691037,为啥迟迟办不了房产证新疆维吾尔自治区党委书记陈全国领导留言板,2021-10-23--17-36-51,求助、城建 W*** 2021-10-23 21:40. 为啥迟迟办不了房产证[待回复]. 书记好！我是乌鲁木齐西山环卫西街卧龙山庄小区10号楼的一名业主，自从2011年11月办理&nbsp;...,为啥迟迟办不了房产证新疆维吾尔自治区党委---2021-10-23--17-36-51.html
http://world.people.com.cn/n1/2021/1023/c1002-32262255.html,中国驻土使馆与新疆举办新疆是个好地方视频交流会人民网,2021-10-23--17-36-12,新华社安卡拉10月23日电（记者郑思远施洋）22日，中国驻土耳其大使馆在安卡拉与新疆<b>维吾尔</b>自治区政府在乌鲁木齐共同举办“新疆是个好地方”视频交流会。,中国驻土使馆与新疆举办新疆是个好地方视频---2021-10-23--17-36-12.html
http://www.chinanews.com/gj/2021/10-23/9593309.shtml,新疆是个好地方土耳其专场视频交流会举行中国新闻网,2021-10-23--17-23-58,新疆<b>维吾尔</b>自治区人大常委会主任肖开提·依明图文并茂地介绍了近年来新疆稳定发展的有关情况。他说：“新疆所做的一切光明磊落、坦坦荡荡，就是为了造福新疆各&nbsp;...,新疆是个好地方土耳其专场视频交流会举行中---2021-10-23--17-23-58.html
http://www.nbd.com.cn/articles/2021-10-23/1958526.html,西部牧业公司生产的饲料主要销售给石河子周边地区长期合作的规模化养殖场每日经济新闻,2021-10-23--17-02-36,畜禽养殖 新疆<b>维吾尔</b>自治区 西部牧业 -1.1%. 每经AI快讯，有投资者在投资者互动平台提问：你好，请问贵公司生产的饲料是否涨价了？自用与销售的比例是多少.,西部牧业公司生产的饲料主要销售给石河子周---2021-10-23--17-02-36.html
https://m.51ore.com/Buy.html?provinceId=65&cityId=&mineTypeId=2&mineId=36,新疆维吾尔自治区_玻璃原料_黑曜岩矿材网,2021-10-23--16-12-52,新疆<b>维吾尔</b>自治区_玻璃原料_黑曜岩_原料求购—矿材网.,新疆维吾尔自治区_玻璃原料_黑曜岩矿材网---2021-10-23--16-12-52.html
http://www.buzhi.com/zhiweibiao/zhiweishow.php?id=Y172364,新疆维吾尔自治区国家税务局招科员二职位1人,2021-10-23--16-11-44,"2017年国家公务员考试新疆<b>维吾尔</b>自治区国家税务局阿图什市国家税务局招录科员（二）职位1人,(职位代码：0701080002),详情访问步知网www.buzhi.com。",新疆维吾尔自治区国家税务局招科员二职位1---2021-10-23--16-11-44.html
