links,titles,pubdates,content,html_file_names
http://www.jiaodong.net/news/system/2021/10/25/014233862.shtml,新疆非遗江格尔在浑厚绵长的旋律里传承胶东在线,2021-10-25--07-22-21,<b>新疆</b>网讯(记者李卫疆). 江格尔到了七岁. 他将勇猛不凡. 东方的千百万魔鬼. 向他归降. 江格尔无私无畏. 心怀坦荡. 六千又十二名勇士团聚在他身旁.,新疆非遗江格尔在浑厚绵长的旋律里传承胶东---2021-10-25--07-22-21.html
https://news.sina.com.cn/c/2021-10-25/doc-iktzscyy1643939.shtml,前三季新疆固定资产投资增长超两成新浪新闻,2021-10-25--06-20-50,石榴云/<b>新疆</b>日报记者石鑫从自治区发展改革委获悉：前三季度，全区固定资产投资（不含农户）同比增长23.2%，比去年同期提高5.9个百分点，增速位居全国第二，&nbsp;...,前三季新疆固定资产投资增长超两成新浪新闻---2021-10-25--06-20-50.html
https://www.guandian.cn/article/20211025/274289.html,住建部前9月全国新开工改造城镇老旧小区占年度目标948观点地产网,2021-10-25--05-56-27,... 安徽、<b>新疆</b>生产建设兵团、河南、山东、河北、江苏、黑龙江、<b>新疆</b>、江西、吉林、甘肃、青海、海南；开工进展排名靠后的地区：湖南、福建、山西、西藏。,住建部前9月全国新开工改造城镇老旧小区占---2021-10-25--05-56-27.html
http://www.altxw.com/news/system/2021/10/25/030103098.shtml,新疆有很多个想不到全国政协港澳台侨委员会考察团来疆考察,2021-10-25--05-47-47,<b>新疆</b>的反恐怖主义、去极端化斗争，坚持从中国和中国<b>新疆</b>实际出发，很多经验、做法值得国际社会借鉴。”全国政协海外列席侨胞，中非友协理事、中非友协安哥拉友好&nbsp;...,新疆有很多个想不到全国政协港澳台侨委员会---2021-10-25--05-47-47.html
http://huaxia.com/c/2021/10/25/836449.shtml,传统馕饼变致富金饼热门评论华夏经纬网,2021-10-25--05-38-34,截至今年6月，<b>新疆</b>全区已建成各类馕产业园区60余个、专业生产加工企业500多家、经营性馕坑超3万个。同时，馕产业在吸纳就业、助力增收方面发挥了积极作用，此前&nbsp;...,传统馕饼变致富金饼热门评论华夏经纬网---2021-10-25--05-38-34.html
http://www.mod.gov.cn/services/2021-10/25/content_4897497.htm,贴心新疆阿克苏军分区军人军属喜领拥军优抚银行卡中华人民共和国国防部,2021-10-25--05-37-03,近期，<b>新疆</b>阿克苏军分区通过与当地银行合作，办理了千余张拥军优抚银行卡，发放给符合条件的官兵和军属。,贴心新疆阿克苏军分区军人军属喜领拥军优抚---2021-10-25--05-37-03.html
http://news.sdnews.com.cn/gn/202110/t20211025_2981388.html,万人说新疆一起到胡安家欣赏传统木雕制作工艺国内新闻,2021-10-25--05-20-00,胡安是阿勒泰地区哈巴河县的木雕手工艺人，父亲是非物质文化遗产传承人。,万人说新疆一起到胡安家欣赏传统木雕制作工---2021-10-25--05-20-00.html
http://news.cnhubei.com/content/2021-10/25/content_14197730.html,万人说新疆艾丽娅想成立一支手风琴乐团荆楚网,2021-10-25--05-15-34,她教了近二百名学生，小到六岁，大到六十岁，孩子们在文化馆启蒙，中老年人在文化馆圆梦。艾丽娅想成立一支手风琴乐团，专门演奏<b>新疆</b>传统的民族音乐。,万人说新疆艾丽娅想成立一支手风琴乐团荆楚---2021-10-25--05-15-34.html
"https://news.cnstock.com/news,bwkx-202110-4772091.htm",国家卫健委24日新增新冠肺炎确诊病例39例其中本土病例35例,2021-10-25--04-56-04,新华社北京10月25日电国家卫生健康委员会25日通报，10月24日0-24时，31个省（自治区、直辖市）和<b>新疆</b>生产建设兵团报告新增新冠肺炎确诊病例39例。,国家卫健委24日新增新冠肺炎确诊病例39---2021-10-25--04-56-04.html
http://www.mod.gov.cn/services/2021-10/25/content_4897476.htm,微压氧舱落户新疆军区某边防团天文点边防连中华人民共和国国防部,2021-10-25--04-32-56,近日，微压氧舱落户<b>新疆</b>军区某边防团天文点边防连。该连结合官兵工作训练实际，制订了微压氧保健计划表，每月对全连官兵进行保健治疗。,微压氧舱落户新疆军区某边防团天文点边防连---2021-10-25--04-32-56.html
https://news.dayoo.com/photo/202110/25/140003_54092539.htm,新疆博斯腾湖秋色醉人广州日报大洋网,2021-10-25--04-22-44,2021年10月24日，无人机航拍<b>新疆</b>博湖县博斯腾湖湿地，芦苇金黄，湖水碧绿。金秋时节，位于巴音郭楞蒙古自治州博湖县境内的博斯腾湖碧波荡漾，大片的芦花绽放&nbsp;...,新疆博斯腾湖秋色醉人广州日报大洋网---2021-10-25--04-22-44.html
http://hk.jrj.com.cn/2021/10/25101833745882.shtml,美股新股前瞻烘焙市场向上乔治香颂携超千万美元营收闯关美股IPO,2021-10-25--04-21-22,智通财经APP获悉，来自<b>新疆</b>乌鲁木齐的<b>新疆</b>和睦家商贸有限责任公司的实质控股公司Chanson International Holding（以下简称“乔治香颂”）向美国证监会(SEC)&nbsp;...,美股新股前瞻烘焙市场向上乔治香颂携超千万---2021-10-25--04-21-22.html
http://www.zytzb.gov.cn/ssmzxw/361787.jhtml,江苏与新疆青海贵州云南四省区共同启动红石榴就业行动,2021-10-25--04-21-22,江苏与<b>新疆</b>、青海、贵州、云南四省区共同启动“红石榴就业行动”. 发布时间：2021-10-25. 来源：中央统战部网站. 打印本文. 【字体： 大 中 小】.,江苏与新疆青海贵州云南四省区共同启动红石---2021-10-25--04-21-22.html
http://www.xj.chinanews.com/shehui/2021-10-25/detail-ihasizte3694866.shtml,电子驾驶证启用首日新疆巴州7万余人踊跃申请,2021-10-25--04-19-48,中新网<b>新疆</b>新闻10月25日电（吴建军陆波严万海）23日，<b>新疆</b>库尔勒市公安局交警大队车辆管理所综合服务大厅，民警正为前来办理车驾管业务的群众提供免费导办、&nbsp;...,电子驾驶证启用首日新疆巴州7万余人踊跃申---2021-10-25--04-19-48.html
http://ex.chinadaily.com.cn/exchange/partners/82/rss/channel/cn/columns/80x78w/stories/WS617544e1a3107be4979f45e4.html,金秋新疆博湖沿途皆风景如诗如画ChinaDaily,2021-10-25--03-55-07,金秋十月的<b>新疆</b>博湖风光无限，最吸引人的还是婀娜多姿的万亩金色芦苇荡。2021年10月24日，一位旅游达人航拍<b>新疆</b>博湖县塔温觉肯乡克日木哈尔村“最美公路”秋景&nbsp;...,金秋新疆博湖沿途皆风景如诗如画China---2021-10-25--03-55-07.html
http://www.workercn.cn/34199/202110/25/211025083533511.shtml,传统馕饼变致富金饼微观中工网,2021-10-25--03-43-21,在<b>新疆</b>，馕是必不可少的传统特色美食。核桃馕、玫瑰馕、巴旦木馕、芝麻馕……馕的做法很多，口味和形状丰富多样。行走在天山南北&nbsp;...,传统馕饼变致富金饼微观中工网---2021-10-25--03-43-21.html
https://wap.peopleapp.com/article/6340382/6230522,新疆伊宁市城管专项整治百日行动见成效人民日报,2021-10-25--03-43-07,今年，<b>新疆</b>伊宁市扎实开展城市管理专项整治提升“百日行动”，对市容市貌进行综合整治，推进城市精细化管理取得实效。目前，伊宁市已完成主城区、滨河大道、&nbsp;...,新疆伊宁市城管专项整治百日行动见成效人民---2021-10-25--03-43-07.html
http://www.sports.cn/yqfk/2021/1025/393069.html,截至10月24日24时新型冠状病毒肺炎疫情最新情况华奥星空,2021-10-25--03-31-46,10月24日0—24时，31个省(自治区、直辖市)和<b>新疆</b>生产建设兵团报告新增确诊病例39例。其中境外输入病例4例(天津1例，上海1例，山东1例，广西1例)；本土病例35&nbsp;...,截至10月24日24时新型冠状病毒肺炎疫---2021-10-25--03-31-46.html
https://news.sina.com.cn/c/2021-10-25/doc-iktzscyy1605447.shtml,本土新增353无症状感染者重症病例新浪新闻,2021-10-25--03-13-27,累计确诊病例9507例，累计治愈出院病例9124例，无死亡病例。 截至10月24日24时，据31个省（自治区、直辖市）和<b>新疆</b>生产建设兵团报告，现有确诊病例&nbsp;...,本土新增353无症状感染者重症病例新浪新---2021-10-25--03-13-27.html
http://www.eeo.com.cn/2021/1025/508663.shtml,国家卫健委31省区市新增确诊病例39例其中本土35例涉及7省份经济观察网专业财经新闻网站,2021-10-25--03-07-16,10月24日0—24时，31个省（自治区、直辖市）和<b>新疆</b>生产建设兵团报告新增确诊病例39例。其中，本土病例35例（内蒙古19例，其中阿拉善盟18例、锡林郭勒盟1例；&nbsp;...,国家卫健委31省区市新增确诊病例39例其---2021-10-25--03-07-16.html
