links,titles,pubdates,content,html_file_names
http://news.china.com.cn/2021-10/25/content_77831070.html,中国发布丨31省份和新疆生产建设兵团接种新冠疫苗2246217万剂次,2021-10-25--07-44-07,截至2021年10月24日，31个省（自治区、直辖市）和<b>新疆</b>生产建设兵团累计报告接种新冠病毒疫苗224621.7万剂次。,中国发布丨31省份和新疆生产建设兵团接种---2021-10-25--07-44-07.html
http://www.nbd.com.cn/articles/2021-10-25/1959819.html,神火股份公司子公司新疆神火处于正常生产状态其配套有四台自备机组,2021-10-25--07-40-44,... 最近电价调整，请问公司是否有自备电厂用于生产。神火股份（000933.SZ）10月25日在投资者互动平台表示，公司子公司<b>新疆</b>神火处于正常生产状态，,神火股份公司子公司新疆神火处于正常生产状---2021-10-25--07-40-44.html
http://www.jiaodong.net/news/system/2021/10/25/014233862.shtml,新疆非遗江格尔在浑厚绵长的旋律里传承胶东在线,2021-10-25--07-22-21,<b>新疆</b>网讯(记者李卫疆). 江格尔到了七岁. 他将勇猛不凡. 东方的千百万魔鬼. 向他归降. 江格尔无私无畏. 心怀坦荡. 六千又十二名勇士团聚在他身旁.,新疆非遗江格尔在浑厚绵长的旋律里传承胶东---2021-10-25--07-22-21.html
http://tradeinservices.mofcom.gov.cn/article/news/gnxw/202110/122666.html,新疆霍尔果斯综保区跨境电商业务突破10亿元人民币,2021-10-25--07-22-05,据<b>新疆</b>霍尔果斯综合保税区(简称综保区)管委会统计，今年1月至今，霍尔果斯跨境电商业务突破5000万票，贸易额突破10亿元(人民币，下同)，已步入发展“快车道”&nbsp;...,新疆霍尔果斯综保区跨境电商业务突破10亿---2021-10-25--07-22-05.html
http://xj.cnr.cn/xjfw_1/tpxw/20211025/t20211025_525642110.shtml,新疆呼图壁留住秋天的孩子们央广网,2021-10-25--06-26-01,央广网呼图壁10月25日消息（马建勋严泽静）秋天，是收获的季节，也是充满诗意的季节。黄的、橙的、红的落叶犹如一个个精灵，随风飘落。<b>新疆</b>昌吉回族自治州呼图壁&nbsp;...,新疆呼图壁留住秋天的孩子们央广网---2021-10-25--06-26-01.html
https://news.sina.com.cn/c/2021-10-25/doc-iktzscyy1643939.shtml,前三季新疆固定资产投资增长超两成新浪新闻,2021-10-25--06-20-50,石榴云/<b>新疆</b>日报记者石鑫从自治区发展改革委获悉：前三季度，全区固定资产投资（不含农户）同比增长23.2%，比去年同期提高5.9个百分点，增速位居全国第二，&nbsp;...,前三季新疆固定资产投资增长超两成新浪新闻---2021-10-25--06-20-50.html
https://www.guandian.cn/article/20211025/274289.html,住建部前9月全国新开工改造城镇老旧小区占年度目标948观点地产网,2021-10-25--05-56-27,... 安徽、<b>新疆</b>生产建设兵团、河南、山东、河北、江苏、黑龙江、<b>新疆</b>、江西、吉林、甘肃、青海、海南；开工进展排名靠后的地区：湖南、福建、山西、西藏。,住建部前9月全国新开工改造城镇老旧小区占---2021-10-25--05-56-27.html
http://www.altxw.com/news/system/2021/10/25/030103098.shtml,新疆有很多个想不到全国政协港澳台侨委员会考察团来疆考察,2021-10-25--05-47-47,<b>新疆</b>的反恐怖主义、去极端化斗争，坚持从中国和中国<b>新疆</b>实际出发，很多经验、做法值得国际社会借鉴。”全国政协海外列席侨胞，中非友协理事、中非友协安哥拉友好&nbsp;...,新疆有很多个想不到全国政协港澳台侨委员会---2021-10-25--05-47-47.html
http://huaxia.com/c/2021/10/25/836449.shtml,传统馕饼变致富金饼热门评论华夏经纬网,2021-10-25--05-38-34,截至今年6月，<b>新疆</b>全区已建成各类馕产业园区60余个、专业生产加工企业500多家、经营性馕坑超3万个。同时，馕产业在吸纳就业、助力增收方面发挥了积极作用，此前&nbsp;...,传统馕饼变致富金饼热门评论华夏经纬网---2021-10-25--05-38-34.html
http://www.mod.gov.cn/services/2021-10/25/content_4897497.htm,贴心新疆阿克苏军分区军人军属喜领拥军优抚银行卡中华人民共和国国防部,2021-10-25--05-37-03,近期，<b>新疆</b>阿克苏军分区通过与当地银行合作，办理了千余张拥军优抚银行卡，发放给符合条件的官兵和军属。,贴心新疆阿克苏军分区军人军属喜领拥军优抚---2021-10-25--05-37-03.html
http://news.sdnews.com.cn/gn/202110/t20211025_2981388.html,万人说新疆一起到胡安家欣赏传统木雕制作工艺国内新闻,2021-10-25--05-20-00,胡安是阿勒泰地区哈巴河县的木雕手工艺人，父亲是非物质文化遗产传承人。,万人说新疆一起到胡安家欣赏传统木雕制作工---2021-10-25--05-20-00.html
http://news.cnhubei.com/content/2021-10/25/content_14197730.html,万人说新疆艾丽娅想成立一支手风琴乐团荆楚网,2021-10-25--05-15-34,她教了近二百名学生，小到六岁，大到六十岁，孩子们在文化馆启蒙，中老年人在文化馆圆梦。艾丽娅想成立一支手风琴乐团，专门演奏<b>新疆</b>传统的民族音乐。,万人说新疆艾丽娅想成立一支手风琴乐团荆楚---2021-10-25--05-15-34.html
"https://news.cnstock.com/news,bwkx-202110-4772091.htm",国家卫健委24日新增新冠肺炎确诊病例39例其中本土病例35例,2021-10-25--04-56-04,新华社北京10月25日电国家卫生健康委员会25日通报，10月24日0-24时，31个省（自治区、直辖市）和<b>新疆</b>生产建设兵团报告新增新冠肺炎确诊病例39例。,国家卫健委24日新增新冠肺炎确诊病例39---2021-10-25--04-56-04.html
http://www.mod.gov.cn/services/2021-10/25/content_4897476.htm,微压氧舱落户新疆军区某边防团天文点边防连中华人民共和国国防部,2021-10-25--04-32-56,近日，微压氧舱落户<b>新疆</b>军区某边防团天文点边防连。该连结合官兵工作训练实际，制订了微压氧保健计划表，每月对全连官兵进行保健治疗。,微压氧舱落户新疆军区某边防团天文点边防连---2021-10-25--04-32-56.html
https://news.dayoo.com/photo/202110/25/140003_54092539.htm,新疆博斯腾湖秋色醉人广州日报大洋网,2021-10-25--04-22-44,2021年10月24日，无人机航拍<b>新疆</b>博湖县博斯腾湖湿地，芦苇金黄，湖水碧绿。金秋时节，位于巴音郭楞蒙古自治州博湖县境内的博斯腾湖碧波荡漾，大片的芦花绽放&nbsp;...,新疆博斯腾湖秋色醉人广州日报大洋网---2021-10-25--04-22-44.html
http://hk.jrj.com.cn/2021/10/25101833745882.shtml,美股新股前瞻烘焙市场向上乔治香颂携超千万美元营收闯关美股IPO,2021-10-25--04-21-22,智通财经APP获悉，来自<b>新疆</b>乌鲁木齐的<b>新疆</b>和睦家商贸有限责任公司的实质控股公司Chanson International Holding（以下简称“乔治香颂”）向美国证监会(SEC)&nbsp;...,美股新股前瞻烘焙市场向上乔治香颂携超千万---2021-10-25--04-21-22.html
http://www.zytzb.gov.cn/ssmzxw/361787.jhtml,江苏与新疆青海贵州云南四省区共同启动红石榴就业行动,2021-10-25--04-21-22,江苏与<b>新疆</b>、青海、贵州、云南四省区共同启动“红石榴就业行动”. 发布时间：2021-10-25. 来源：中央统战部网站. 打印本文. 【字体： 大 中 小】.,江苏与新疆青海贵州云南四省区共同启动红石---2021-10-25--04-21-22.html
http://www.xj.chinanews.com/shehui/2021-10-25/detail-ihasizte3694866.shtml,电子驾驶证启用首日新疆巴州7万余人踊跃申请,2021-10-25--04-19-48,中新网<b>新疆</b>新闻10月25日电（吴建军陆波严万海）23日，<b>新疆</b>库尔勒市公安局交警大队车辆管理所综合服务大厅，民警正为前来办理车驾管业务的群众提供免费导办、&nbsp;...,电子驾驶证启用首日新疆巴州7万余人踊跃申---2021-10-25--04-19-48.html
http://ex.chinadaily.com.cn/exchange/partners/82/rss/channel/cn/columns/80x78w/stories/WS617544e1a3107be4979f45e4.html,金秋新疆博湖沿途皆风景如诗如画ChinaDaily,2021-10-25--03-55-07,金秋十月的<b>新疆</b>博湖风光无限，最吸引人的还是婀娜多姿的万亩金色芦苇荡。2021年10月24日，一位旅游达人航拍<b>新疆</b>博湖县塔温觉肯乡克日木哈尔村“最美公路”秋景&nbsp;...,金秋新疆博湖沿途皆风景如诗如画China---2021-10-25--03-55-07.html
https://news.bjx.com.cn/html/20211025/1183509.shtml,单位千瓦2290元不含塔筒金风科技预中标华电集团达坂城50MW风电项目北极星风力发电网,2021-10-25--03-52-51,"单位千瓦2290元（不含塔筒）！金风科技预中标华电集团达坂城50MW风电项目！,近日，<b>新疆</b>华电达坂城100MW(一期50MW)风电项目工程风电机组及附属设备采购批次评&nbsp;...",单位千瓦2290元不含塔筒金风科技预中标---2021-10-25--03-52-51.html
