links,titles,pubdates,content,html_file_names
http://www.sports.cn/yqfk/2021/1025/393069.html,截至10月24日24时新型冠状病毒肺炎疫情最新情况华奥星空,2021-10-25--03-31-46,10月24日0—24时，31个省(自治区、直辖市)和<b>新疆</b>生产建设兵团报告新增确诊病例39例。其中境外输入病例4例(天津1例，上海1例，山东1例，广西1例)；本土病例35&nbsp;...,截至10月24日24时新型冠状病毒肺炎疫---2021-10-25--03-31-46.html
https://news.southcn.com/node_54a44f01a2/22733224dc.shtml,广东产业援疆变输血为造血为富民兴疆注入源头活水南方网,2021-10-25--02-21-25,<b>新疆</b>喀什疏附县吾库萨克镇，粤港澳大湾区菜篮子基地里，一排塑料蔬菜大棚在暖阳照耀下反射着银白色的光。今年以来，这里的蔬菜在广东乃至港澳地区的餐馆、&nbsp;...,广东产业援疆变输血为造血为富民兴疆注入源---2021-10-25--02-21-25.html
https://finance.sina.com.cn/money/future/roll/2021-10-25/doc-iktzqtyu3346212.shtml,新疆调研棉花单产总产可能不及去年新浪财经,2021-10-25--02-21-15,"随着气温的不断下降，棉花(20985, -620.00, -2.87%)叶片脱落速度加快，<b>新疆</b>棉花采摘进入高峰。10月10—17日，期货日报记者在南疆对棉花生产形势进行了全面调研。",新疆调研棉花单产总产可能不及去年新浪财经---2021-10-25--02-21-15.html
http://info.texnet.com.cn/detail-873643.html,新疆棉花平均单产总产预计都低于去年,2021-10-25--02-20-04,10月21日，在中国棉花协会召开的四届五次常务理事会暨全国棉花形势分析会上，<b>新疆</b>.,新疆棉花平均单产总产预计都低于去年---2021-10-25--02-20-04.html
https://www.cnfeol.com/gangtie/n_095038345360.aspx,新疆钢铁协会开展疆内重点钢铁企业能效对标工作中国铁合金在线,2021-10-25--01-57-55,今年以来，<b>新疆</b>自治区党委、人民政府深入贯彻习近平生态文明思想，把落实能耗“双控”制度作为破解资源环境瓶颈约束、建设生态文明、推动高质量发展、实现碳达&nbsp;...,新疆钢铁协会开展疆内重点钢铁企业能效对标---2021-10-25--01-57-55.html
http://www.cz001.com.cn/?m=detail&id=27025,常州一秒入冬他们还正说着秋天的故事,2021-10-25--01-28-47,寻秋档案：每到秋季，他总会拿起相机，奔赴全国各地，拍下最美的秋色。 岳建清在<b>新疆</b>拍摄秋天里的胡杨. 13日，65岁的岳建清和同道朋友乘火车，赶往<b>新疆</b>。,常州一秒入冬他们还正说着秋天的故事---2021-10-25--01-28-47.html
http://news.ts.cn/system/2021/10/25/036722543.shtml,提高斗争本领讲好新疆故事天山网,2021-10-25--01-15-23,天山网-<b>新疆</b>日报记者李杨曹华张艳芳梁立华. 习近平总书记指出，中华民族伟大复兴绝不是轻轻松松、敲锣打鼓就能实现的。回望过去的五年，全区广大党员干部&nbsp;...,提高斗争本领讲好新疆故事天山网---2021-10-25--01-15-23.html
https://cn.chinadaily.com.cn/a/202110/25/WS617600e4a3107be4979f4624.html,31省区市新增35例本土确诊病例内蒙古新增本土确诊19例中国日报网,2021-10-25--01-06-47,10月24日0—24时，31个省（自治区、直辖市）和<b>新疆</b>生产建设兵团报告新增确诊病例39例。其中境外输入病例4例；本土病例35例，含5例由无症状感染者转为确诊病例&nbsp;...,31省区市新增35例本土确诊病例内蒙古新---2021-10-25--01-06-47.html
https://gas.in-en.com/html/gas-3648179.shtml,1800万立方米储气能力青海省今冬安排天然气资源量增长约58国际燃气网,2021-10-25--01-03-22,为保障全省各族群众生产生活用能需要，在省政府统一部署下，省能源局赴<b>新疆</b>维吾尔自治区、内蒙古自治区协调煤炭调入工作，争取疆煤入青增供155万吨，协调省&nbsp;...,1800万立方米储气能力青海省今冬安排天---2021-10-25--01-03-22.html
http://www.legaldaily.com.cn/index/content/2021-10/25/content_8615308.htm,2021年国家统一法律职业资格考试客观题考试成绩10月25日公布法制网,2021-10-25--00-18-42,客观题考试放宽合格分数线分为三档，西藏自治区放宽合格分数线为140分；青海、四川、云南、甘肃四省涉藏州县，<b>新疆</b>南疆四地州，四川凉山州、云南怒江州和&nbsp;...,2021年国家统一法律职业资格考试客观题---2021-10-25--00-18-42.html
http://m.ce.cn/bwzg/202110/25/t20211025_37023860.shtml,新疆馕打响特字号,2021-10-25--00-06-49,在<b>新疆</b>，馕是各族群众喜爱的食品，对许多居民来说，一天的生活就是由一块干馕、一碗奶茶开启的。近年来，<b>新疆</b>努力将地域特色产品转化为产业发展亮色，馕产业逐步&nbsp;...,新疆馕打响特字号---2021-10-25--00-06-49.html
http://epaper.tianjinwe.com/mrxb/html/2021-10/25/content_19047_5190053.htm,每日新报数字报刊平台第五届和平杯非遗曲艺票友邀请赛落幕天津日报,2021-10-24--23-55-08,在邀请赛颁奖晚会上，来自<b>新疆</b>的莱帕尔《劳动与爱情》、河南坠子《长征托婴》和长子鼓书《长治美》等作品呈现出中国曲艺的丰富和精彩。,每日新报数字报刊平台第五届和平杯非遗曲艺---2021-10-24--23-55-08.html
https://www.rfa.org/mandarin/pinglun/xueyumantan/wlx-10242021193419.html,评论王力雄回忆新疆旅行见闻二十五,2021-10-24--23-42-33,若是想在<b>新疆</b>搞有专业水平的民族问题调查，没有官方配合是不可能做到的。,评论王力雄回忆新疆旅行见闻二十五---2021-10-24--23-42-33.html
http://news.hsw.cn/system/2021/1025/1386586.shtml,陕西是全国苹果和猕猴桃生产第一大省以果为媒助推南北交流,2021-10-24--23-15-00,陕西省果业中心主任魏延安介绍，西部是我国主要水果产区，西部果业协同创新联盟由内蒙古、广西、重庆、四川、贵州、云南、西藏、陕西、甘肃、青海、宁夏、<b>新疆</b>等&nbsp;...,陕西是全国苹果和猕猴桃生产第一大省以果为---2021-10-24--23-15-00.html
http://news.enorth.com.cn/system/2021/10/24/051961183.shtml,国产灭活疫苗第三针效果如何新闻中心北方网,2021-10-24--23-01-25,近来<b>新疆</b>、甘肃、内蒙古、陕西等地相继出现确诊病例和无症状感染者。国产灭活疫苗对新冠病毒尤其是德尔塔变异株是否具有保护作用？注射加强针效果如何？,国产灭活疫苗第三针效果如何新闻中心北方网---2021-10-24--23-01-25.html
http://epaper.tianjinwe.com/tjrb/html/2021-10/25/content_162_5188712.htm,天津日报数字报刊平台独山子泥火山图,2021-10-24--22-32-07,在<b>新疆</b>，海拔普遍较高，其实这也本属寻常。 1907年，我国第一批石油人在独山子做地质勘探，偶然发现其山顶部有几处泥浆喷发口，一刻&nbsp;...,天津日报数字报刊平台独山子泥火山图---2021-10-24--22-32-07.html
http://news.jcrb.com/jsxw/2021/202110/t20211024_2330676.html,今年法律职业资格考试客观题成绩哪天能查分数线多少主观题考试如何报名交费司法部发布公告,2021-10-24--22-02-08,"放宽合格分数线分为三档,西藏自治区放宽合格分数线为140分;青海、四川、云南、甘肃四省涉藏州县,<b>新疆</b>南疆四地州,四川凉山州、云南怒江州和甘肃临夏州以及&nbsp;...",今年法律职业资格考试客观题成绩哪天能查分---2021-10-24--22-02-08.html
http://www.ce.cn/xwzx/gnsz/gdxw/202110/25/t20211025_37023839.shtml,新疆馕打响特字号中国经济网,2021-10-24--21-59-00,在<b>新疆</b>，馕是各族群众喜爱的食品，对许多居民来说，一天的生活就是由一块干馕、一碗奶茶开启的。近年来，<b>新疆</b>努力将地域特色产品转化为产业发展亮色，馕产业逐步&nbsp;...,新疆馕打响特字号中国经济网---2021-10-24--21-59-00.html
https://finance.sina.com.cn/tech/2021-10-24/doc-iktzscyy1527740.shtml,新疆霍尔果斯综保区跨境电商业务突破10亿元人民币新浪财经,2021-10-24--21-58-39,中新社<b>新疆</b>霍尔果斯10月24日电(李明李辉慧)据<b>新疆</b>霍尔果斯综合保税区(简称综保区)管委会统计，今年1月至今，霍尔果斯跨境电商业务突破5000万票，贸易额&nbsp;...,新疆霍尔果斯综保区跨境电商业务突破10亿---2021-10-24--21-58-39.html
https://www.xjnu.edu.cn/2021/1023/c233a116822/page.htm,图新疆师范大学访民情惠民生聚民心系列活动简报第384期,2021-10-24--20-15-30,为持续巩固拓展脱贫攻坚成果，发挥消费帮扶在促进乡村振兴中的重要作用，我校精准落实“我为群众办实事”实践活动，在定点帮扶村亚喀艾日克（8）村发展农家鸡&nbsp;...,图新疆师范大学访民情惠民生聚民心系列活动---2021-10-24--20-15-30.html
