links,titles,pubdates,content,html_file_names
http://www.altxw.com/news/system/2021/07/04/030090634.shtml,自治区党委九届十二次全会召开,2021-07-04--15-22-30,审议通过《中国共产党新疆<b>维吾尔</b>自治区第九届委员会第十二次全体会议关于深入学习贯彻习近平总书记在庆祝中国共产党成立100周年大会上的重要讲话&nbsp;...,自治区党委九届十二次全会召开---2021-07-04--15-22-30.html
https://ie.bjd.com.cn/5b165687a010550e5ddc0e6a/contentApp/5b21d73be4b02439500383f1/AP60dfbae7e4b02c39a4174b8f?isshare=1&innerId=1,维吾尔族小伙儿参演伟大征程终于有机会作为党员奉献_北京日报APP新闻,2021-07-04--06-36-04,<b>维吾尔</b>族小伙儿参演《伟大征程》：终于有机会作为党员奉献. 北京日报客户端 | 记者韩轩. 2021-07-03 09:18. 庆祝中国共产党成立100周年文艺演出《&nbsp;...,维吾尔族小伙儿参演伟大征程终于有机会作为---2021-07-04--06-36-04.html
https://www.jiemian.com/article/6317710.html,新疆维吾尔自治区发布高温红色预警吐鲁番市局地可达45以上界面新闻,2021-07-04--05-32-48,新疆<b>维吾尔</b>自治区气象台7月4日12时5分将高温橙色升级为高温红色预警信号：预计今天午后到7日，博州东部、塔城地区南部、克拉玛依市、石河子市&nbsp;...,新疆维吾尔自治区发布高温红色预警吐鲁番市---2021-07-04--05-32-48.html
http://www.faxin.cn/lib/dffl/DfflSimple.aspx?gid=B533690&libid=010204,新疆维吾尔自治区药品监督管理局转发国家局进一步加强直接接触药品的包装材料和容器监督管理,2021-07-04--05-07-23,新疆<b>维吾尔</b>自治区药品监督管理局转发国家局进一步加强直接接触药品的包装材料和容器监督管理通知的通知. 伊犁哈萨克自治州药品监督管理局，各地、&nbsp;...,新疆维吾尔自治区药品监督管理局转发国家局---2021-07-04--05-07-23.html
https://www.zhuinw.com/blog/article/13831.html,新疆维吾尔自治区人力资源和社会保障厅wwwxjrsgovcn网站目录,2021-07-04--05-00-43,该站已被浏览1次，我们无法保证新疆<b>维吾尔</b>自治区人力资源和社会保障厅所有的网站相关链接的准确性，且该网站的链接不由本站所能控制，如果&nbsp;...,新疆维吾尔自治区人力资源和社会保障厅ww---2021-07-04--05-00-43.html
http://www.ccgp-xinjiang.gov.cn/ZcyAnnouncement/ZcyAnnouncement2/ZcyAnnouncement3003/4L0Zw3/d1eYI5B6qDL6NLw==.html,新疆维吾尔自治区阿克苏地区政府采购中心关于新疆维吾尔自治区人民检察院阿克苏分院干警服装,2021-07-04--04-35-12,新疆<b>维吾尔</b>自治区人民检察院阿克苏分院干警服装项目采购项目的潜在供应商应在政采云平台获取采购文件，并于2021年07月13日10:20（北京时间）前&nbsp;...,新疆维吾尔自治区阿克苏地区政府采购中心关---2021-07-04--04-35-12.html
https://www.youbianku.com/%D0%C2%BD%AE%CE%AC%CE%E1%B6%FB%D7%D4%D6%CE%C7%F8%B9%FE%C3%DC%B5%D8%C7%F8%B9%FE%C3%DC%CA%D0%B0%CB%D2%BB%C4%CF%C2%B7,新疆维吾尔自治区哈密地区哈密市八一南路839000邮政编码查询邮编库️,2021-07-04--04-11-30,八一南路位于新疆<b>维吾尔</b>自治区哈密地区哈密市，其邮政编码是839000，详细位置请看下面的在线地图，您还可以在此留言。,新疆维吾尔自治区哈密地区哈密市八一南路8---2021-07-04--04-11-30.html
https://news.sina.com.cn/c/2021-07-04/doc-ikqciyzk3468858.shtml,新疆维吾尔自治区发布高温红色预警吐鲁番市局地可达45以上,2021-07-04--04-07-30,据中国天气网消息，新疆<b>维吾尔</b>自治区气象台2021年7月4日12时5分将高温橙色升级为高温红色预警信号：预计今天午后到7日，博州东部、塔城地区南部&nbsp;...,新疆维吾尔自治区发布高温红色预警吐鲁番市---2021-07-04--04-07-30.html
https://cn.linkedin.com/in/%E5%B0%8F%E7%90%83-%E8%A2%81-8b3175201?trk=public_profile_browsemap_profile-result-card_result-card_full-click,石河子大学中国新疆维吾尔自治区LinkedIn袁小球,2021-07-04--02-46-04,袁小球| 中国新疆<b>维吾尔</b>自治区| 学生- 石河子大学| 0 位好友| 查看小球的首页、档案、动态、文章.,石河子大学中国新疆维吾尔自治区Linke---2021-07-04--02-46-04.html
https://www.360tax.net/forum.php/forum.php?mod=viewthread&action=printable&tid=205708,新疆维吾尔自治区税务牛快计社区PoweredbyDiscuz,2021-07-04--02-22-08,根据《国税地税征管体制改革方案》，原新疆<b>维吾尔</b>自治区国家税务局、新疆<b>维吾尔</b>自治区地方税务局于2018年6月15日合并成立自治区新税务机构。,新疆维吾尔自治区税务牛快计社区Power---2021-07-04--02-22-08.html
http://www.legaldaily.com.cn/index/content/2021-07/04/content_8543126.htm,高标准抓好各项工作确保全面完成既定目标任务,2021-07-04--01-52-30,法治日报全媒体记者潘从武. 根据全国政法队伍教育整顿第16督导组和新疆<b>维吾尔</b>自治区党委安排，7月3日，新疆<b>维吾尔</b>自治区召开第一批政法队伍教育&nbsp;...,高标准抓好各项工作确保全面完成既定目标任---2021-07-04--01-52-30.html
http://www.legaldaily.com.cn/index/content/2021-07/04/content_8543125.htm,新疆检察机关邀请人大代表政协委员视察调研检察工作,2021-07-04--01-52-30,... 人大代表监督，促进新疆检察工作全面健康发展，6月21日至25日，新疆<b>维吾尔</b>自治区人民检察院邀请部分人大代表、政协委员调研新疆检察工作。,新疆检察机关邀请人大代表政协委员视察调研---2021-07-04--01-52-30.html
http://www.xjboz.gov.cn/info/1985/69170.htm,新疆维吾尔自治区启动重大突发公共卫生事件一级响应博尔塔拉蒙古自治州人民政府,2021-07-04--01-41-19,天山网讯根据《新疆<b>维吾尔</b>自治区突发公共卫生事件应急预案》，结合当前疫情防控形势，新疆<b>维吾尔</b>自治区人民政府决定，自即日起，启动自治区重大&nbsp;...,新疆维吾尔自治区启动重大突发公共卫生事件---2021-07-04--01-41-19.html
https://www.zhihu.com/question/440478166/answer/1773330920,有没有学中国少数民族语言文学维吾尔语的同学你们学的咋样啊小小月月的回答知乎,2021-07-04--01-21-23,借楼，有学<b>维吾尔</b>语专业的同学吗，考研想考那个专业.,有没有学中国少数民族语言文学维吾尔语的同---2021-07-04--01-21-23.html
http://www.tianqi.com/alarmnews/2106041765432141.html,新疆维吾尔自治区阿勒泰市202106041704发布雷电黄色预警,2021-07-04--00-33-43,布尔津县气象台2021年6月4日17时3分发布雷电黄色预警信号：目前我县已出现雷电活动，预计今日午后至夜间仍将有雷电活动，局地可能出现短时强&nbsp;...,新疆维吾尔自治区阿勒泰市20210604---2021-07-04--00-33-43.html
https://m.xpcha.com/cidian/86762eyeosz.html,quot维吾尔语quot的解释汉语词典,2021-07-03--23-45-16,<b>维吾尔</b>语的汉语词典解释：<b>维吾尔</b>语（wéi wú ěr yǔ），1.<b>维吾尔</b>族的语言。属阿尔泰语系突厥语族。主要分布在我国新疆<b>维吾尔</b>自治区。在我国<b>维吾尔</b>语&nbsp;...,quot维吾尔语quot的解释汉语词典---2021-07-03--23-45-16.html
http://www.xjdjczxs.com/News_details.php?id=UzcGNgU9AzY%3D&Newsbigtype=BIEErlfnV7BWsVb4VZ5e%2Fw%3D%3D,新疆维吾尔自治区电力承装修试企业协会,2021-07-03--23-10-51,章程经协会业务指导单位—国家能源局新疆监管办公室审查批准后后于2014年5月9日报新疆<b>维吾尔</b>自治区民政厅备案审查。5月21日协会秘书处接到民政厅&nbsp;...,新疆维吾尔自治区电力承装修试企业协会---2021-07-03--23-10-51.html
http://www.chinanews.com/gn/2021/07-04/9512429.shtml,法官赵瑞琴情理法一体做调解,2021-07-03--22-30-00,在新疆<b>维吾尔</b>自治区昌吉回族自治州中级法院“赵瑞琴法官工作室”内，一场诉前调解刚刚开始。为了缓和紧张的气氛，赵瑞琴一边说，一边笑着给双方&nbsp;...,法官赵瑞琴情理法一体做调解---2021-07-03--22-30-00.html
http://baike.baidu.com/item/%E4%B8%AD%E5%9B%BD%E9%80%9A%E5%8F%B2-%E7%AC%AC3%E5%8D%B7-%E7%BB%B4%E5%90%BE%E5%B0%94%E6%96%87/12500422?noadapt=1,中国通史第3卷维吾尔文_百度百科,2021-07-03--22-28-16,中国通史-第3卷-<b>维吾尔</b>文》是2009年新疆人民出版社出版的图书。...,中国通史第3卷维吾尔文_百度百科---2021-07-03--22-28-16.html
https://www.tianqi.com/alarmnews/2011191865300141.html,新疆维吾尔自治区克孜勒苏柯尔克孜自治州阿图什市2020111918,2021-07-03--21-58-06,当前位置：天气网 &gt; 天气预警. 新疆<b>维吾尔</b>自治区克孜勒苏柯尔克孜自治州阿图什市2020-11-19 18:40发布暴雪蓝色预警 2020-11-19 18:40:00 来源：&nbsp;...,新疆维吾尔自治区克孜勒苏柯尔克孜自治州阿---2021-07-03--21-58-06.html
