links,titles,pubdates,content,html_file_names
http://www.chinanews.com/gn/2021/07-28/9530771.shtml,外交部新疆已停止对韩国登山家金洪彬的搜救多日搜寻未发现踪迹,2021-07-28--10-18-45,目前，<b>新疆</b>已停止相关搜救工作。经多日搜寻，未发现金先生踪迹，中方对此表示遗憾。 赵立坚介绍称，得知&nbsp;...,外交部新疆已停止对韩国登山家金洪彬的搜救---2021-07-28--10-18-45.html
http://www.nbd.com.cn/articles/2021-07-28/1856539.html,长信科技新疆润丰累计质押8615万股,2021-07-28--10-12-58,每经AI快讯，长信科技（SZ 300088，收盘价：8.22元）7月28日晚间发布公告称，截至本公告日，<b>新疆</b>润丰股权投资企业（有限合伙）累计质押股数&nbsp;...,长信科技新疆润丰累计质押8615万股---2021-07-28--10-12-58.html
https://finance.sina.com.cn/stock/hkstock/ggscyd/2021-07-28/doc-ikqcfnca9556897.shtml,长信科技300088SZ股东新疆润丰质押1240万股,2021-07-28--10-07-30,)发布公告，公司近日接到股东<b>新疆</b>润丰股权投资企业(有限合伙)(简称“<b>新疆</b>润丰”)的通知，获悉<b>新疆</b>润丰将其所持有的公司部分股份办理了质押的手续，其本&nbsp;...,长信科技300088SZ股东新疆润丰质押---2021-07-28--10-07-30.html
https://mil.news.sina.com.cn/china/2021-07-28/doc-ikqcfnca9555946.shtml,新疆军区某团南疆军区某边防团组织无人机骨干培训,2021-07-28--10-07-30,原标题：上升、转向、降落……这次培训“科技范”十足. 来源：西部战区. 近日，<b>新疆</b>军区某团、南疆军区某边防团组织无人机骨干培训，提升部队战斗力&nbsp;...,新疆军区某团南疆军区某边防团组织无人机骨---2021-07-28--10-07-30.html
http://www.kns.gov.cn/001/001003/20210728/fbb4e784-f522-4547-b4d6-16cc561149fa.html,权威发布在自治区例行新闻发布会上新疆不动产登记3项业务实现跨省通办_喀纳斯景区管理,2021-07-28--09-57-15,天山网-<b>新疆</b>日报讯（记者刘翔报道）从自治区不动产登记3项业务“跨省通办”新闻发布会上获悉：即日起，<b>新疆</b>实现商品房预售和抵押涉及的不动产预告&nbsp;...,权威发布在自治区例行新闻发布会上新疆不动---2021-07-28--09-57-15.html
http://www.chinanews.com/shipin/cns/2021/07-28/news896171.shtml,新疆高温霸榜火焰山景区地表高温达77度,2021-07-28--09-22-30,7 月27 日，<b>新疆</b>将高温橙色预警信号升级为高温红色预警信号，全疆大部分地区在35℃以上的高温天气，其中伊犁哈萨克自治州、克拉玛依市、石河子&nbsp;...,新疆高温霸榜火焰山景区地表高温达77度---2021-07-28--09-22-30.html
http://www.chinanews.com/cj/2021/07-28/9530726.shtml,中欧班列拉动新疆口岸经济,2021-07-28--09-22-30,近日，记者探访了位于中国西北部的<b>新疆</b>阿拉山口口岸，这里是中欧班列西通道咽喉之地，铁轨穿城而过，火车往来不绝。这座曾因大风而常“出风头”的&nbsp;...,中欧班列拉动新疆口岸经济---2021-07-28--09-22-30.html
http://www.xj.xinhuanet.com/2021-07/28/c_1127703846.htm,这里是新疆尼合买提绘起手鼓唱起歌,2021-07-28--08-37-30,尼合买提·热合木都拉在<b>新疆</b>国际大巴扎经营一家手鼓店，他卖的手鼓与别家不同。一面面普通的手鼓，经过尼合买提·热合木都拉的绘画摇身一变成为精美&nbsp;...,这里是新疆尼合买提绘起手鼓唱起歌---2021-07-28--08-37-30.html
http://www.xj.xinhuanet.com/2021-07/28/c_1127703803.htm,这里是新疆手工铜器老手艺带来致富新收益,2021-07-28--08-37-30,今年6月，喀什维吾尔族铜器制作技艺被确定为国家级非物质文化遗产代表性项目。苏来曼·麦麦提敏在<b>新疆</b>国际大巴扎经营一家手工铜器店，他叔叔是&nbsp;...,这里是新疆手工铜器老手艺带来致富新收益---2021-07-28--08-37-30.html
http://www.banyuetan.org/ywdt/detail/20210728/1000200033137681627459659737833199_1.html,旅游季透过新疆之窗见证真实新疆半月谈,2021-07-28--08-34-02,在位于乌鲁木齐市的<b>新疆</b>国际大巴扎，位于<b>新疆</b>首府乌鲁木齐市城南的<b>新疆</b>国际大巴扎连日来游人如织，苏来曼几年前在<b>新疆</b>国际大巴扎租下一间位置上&nbsp;...,旅游季透过新疆之窗见证真实新疆半月谈---2021-07-28--08-34-02.html
http://www.ccgp-xinjiang.gov.cn/ZcyAnnouncement/ZcyAnnouncement1/ZcyAnnouncement3012/PYWK9NwnxdxasxccLempjg==.html,新疆维吾尔自治区妇女联合会新疆女声网站运营维护单一来源采购项目,2021-07-28--08-29-58,采用单一来源采购方式的原因及说明： 由于各家网站服务器采用的数据库不同，如果另选<b>新疆</b>女声网站运营服务承接商，将出现数据迁移过程中存在数据&nbsp;...,新疆维吾尔自治区妇女联合会新疆女声网站运---2021-07-28--08-29-58.html
http://www.workercn.cn/28261/202107/28/210728151209743.shtml,7月新疆国际大巴扎游人如织滚动新闻中工网,2021-07-28--07-36-10,"7月，<b>新疆</b>国际大巴扎游人如织——大巴扎,<b>新疆</b>国际,7月,<b>新疆</b>,游人如织,旅游,城南,大巴扎连日来,山江,维吾尔.",7月新疆国际大巴扎游人如织滚动新闻中工网---2021-07-28--07-36-10.html
https://finance.sina.com.cn/money/future/ncpbj/2021-07-28/doc-ikqcfnca9535323.shtml,2021年7月28日菜油散装价格行情,2021-07-28--06-56-15,菜油(散装) 16元/公斤<b>新疆</b>乌鲁木齐北园春批发市场. 菜油(散装) 12.5元/公斤<b>新疆</b>博乐市农五师三和市场. 菜油(散装) 12.5元/公斤<b>新疆</b>焉耆县光明农副产品&nbsp;...,2021年7月28日菜油散装价格行情---2021-07-28--06-56-15.html
https://finance.sina.com.cn/money/future/ncpbj/2021-07-28/doc-ikqcfnca9551649.shtml,7月28日新疆枣价行情,2021-07-28--06-56-15,7月28日<b>新疆</b>枣价行情. 7月28日<b>新疆</b>枣价行情. 2021年07月28日17:43 农产品期货网 &middot; 新浪财经APP 缩小字体 放大字体 收藏 微博 微信 分享. 腾讯QQ QQ&nbsp;...,7月28日新疆枣价行情---2021-07-28--06-56-15.html
https://sports.sina.com.cn/l/2021-07-28/doc-ikqciyzk8121220.shtml,新疆彩民购彩8年中双色球1492万兑完奖号当场懵圈,2021-07-28--06-45-00,7月1日一大早，徐先生在家人的陪同下，来到<b>新疆</b>福利彩票发行中心办理兑奖手续。据悉，徐先生购买福利彩票已经八多年了，平时基本上只买双色球，&nbsp;...,新疆彩民购彩8年中双色球1492万兑完奖---2021-07-28--06-45-00.html
https://mil.news.sina.com.cn/dgby/2021-07-28/doc-ikqcfnca9518076.shtml,美独立媒体西方涉疆报道假得彻头彻尾,2021-07-28--06-45-00,美国新兴独立媒体BT News近日制作一档节目，报道了一份由意大利学者撰写的<b>新疆</b>问题报告，揭示了西方反华势力瞄准<b>新疆</b>散布虚假信息，误导国际&nbsp;...,美独立媒体西方涉疆报道假得彻头彻尾---2021-07-28--06-45-00.html
http://www.ce.cn/xwzx/gnsz/gdxw/202107/28/t20210728_36757694.shtml,新疆阿勒泰市开展微笑志愿服务,2021-07-28--05-48-45,<b>新疆</b>阿勒泰市新时代文明实践志愿服务推动日活动日前启动，本次活动以“微笑志愿服务”为重心，主要推出关爱老人、法律咨询、健康知识普及等服务。,新疆阿勒泰市开展微笑志愿服务---2021-07-28--05-48-45.html
http://www.xj.xinhuanet.com/2021-07/28/c_1127704311.htm,新疆乌伦古湖畔它们有了安居房,2021-07-28--05-15-00,木头支架、小木屋、小石屋、木头堆……在<b>新疆</b>北部阿勒泰地区福海县乌伦古湖国家湿地公园，路旁的草丛里近期出现了不少高低不一、形状各异的木头&nbsp;...,新疆乌伦古湖畔它们有了安居房---2021-07-28--05-15-00.html
http://m.legaldaily.com.cn/index/content/2021-07/28/content_8565537.htm,新疆未成年人检察工作现场会提出为孩子们健康成长提供综合司法保护,2021-07-28--04-52-30,"法治日报全媒体记者潘从武通讯员徐志康. 以“检察蓝”守护孩子们眼中的“星辰”,近日在沙湾市召开的<b>新疆</b>全区未成年人检察工作现场会提出,强化未成年人&nbsp;...",新疆未成年人检察工作现场会提出为孩子们健---2021-07-28--04-52-30.html
http://www.ccgp-xinjiang.gov.cn/ZcyAnnouncement/ZcyAnnouncement2/ZcyAnnouncement3011/+nNqzeAgWoYEBcEHGLjsHQ==.html,托木尔新疆天山世界自然遗产地片区保护管理规划项目竞争性磋商公告,2021-07-28--04-43-25,托木尔<b>新疆</b>天山世界自然遗产地片区保护管理规划项目采购项目的潜在供应商应在<b>新疆</b>政府采购网获取采购文件，并于2021年08月09日11:00（北京&nbsp;...,托木尔新疆天山世界自然遗产地片区保护管理---2021-07-28--04-43-25.html
