links,titles,pubdates,content,html_file_names
https://finance.sina.com.cn/money/future/roll/2021-08-17/doc-ikqcfncc3272911.shtml,红枣期货续创上市以来新高背后的原因是,2021-08-16--23-15-00,本轮红枣价格上涨的核心驱动是新季红枣预期减产30%以上，连续四年主产区<b>新疆</b>红枣种植面积下降和产量连续下降令2021/2022年度红枣供应存在一定&nbsp;...,红枣期货续创上市以来新高背后的原因是---2021-08-16--23-15-00.html
http://www.cchicc.org.cn/art/2021/8/16/art_397_36468.html,中国文物信息咨询中心赴新疆开展文物援疆工作,2021-08-16--19-46-46,为深入贯彻习近平总书记关于<b>新疆</b>工作的重要讲话精神，落实第三次中央<b>新疆</b>工作座谈会、第八次全国对口支援<b>新疆</b>工作会议、文化和旅游部、国家文物&nbsp;...,中国文物信息咨询中心赴新疆开展文物援疆工---2021-08-16--19-46-46.html
http://paper.cnstock.com/html/2021-08/17/content_1508654.htm,广汇能源股份有限公司关于控股股东新疆广汇实业投资集团有限责任公司非公开发行2021年可,2021-08-16--19-25-05,根据《<b>新疆</b>广汇实业投资（集团）有限责任公司非公开发行2021年可交换公司债券（第一期）募集说明书》，本期债券发行期限为900天，发行价格为每张&nbsp;...,广汇能源股份有限公司关于控股股东新疆广汇---2021-08-16--19-25-05.html
http://paper.cnstock.com/html/2021-08/17/content_1508295.htm,新疆亿路万源实业控股股份有限公司立案调查进展暨风险提示公告,2021-08-16--19-25-05,公司于2019年5月10日收到中国证券监督管理委员会<b>新疆</b>监管局下达的《中国证监会的立案调查通知书》（编号：新证调查字【2019】21号），因公司&nbsp;...,新疆亿路万源实业控股股份有限公司立案调查---2021-08-16--19-25-05.html
http://www.gec.ac.cn/zqkx/8377.jhtml,8月15日9时44分新疆喀什地区叶城县发生31级地震,2021-08-16--17-41-37,摘要：. 据中国地震台网测定，北京时间2021年8月15日9时44分在<b>新疆</b>喀什地区叶城县&nbsp;...,8月15日9时44分新疆喀什地区叶城县发---2021-08-16--17-41-37.html
http://www.ccgp-xinjiang.gov.cn/ZcyAnnouncement/ZcyAnnouncement2/ZcyAnnouncement3002/useoy9Q66uGfTraJDKE0ug==.html,陕西翰鼎工程项目管理有限公司关于新疆准东经济技术开发区人力资源和社会保障局新疆准东产教,2021-08-16--16-22-52,<b>新疆</b>准东经济技术开发区人力资源和社会保障局<b>新疆</b>准东产教融合科技创新园项目消防检测服务项目采购项目的潜在供应商应在<b>新疆</b>维吾尔自治区昌吉市&nbsp;...,陕西翰鼎工程项目管理有限公司关于新疆准东---2021-08-16--16-22-52.html
http://news.carnoc.com/list/567/567731.html,图片新疆机场集团空管业务部邀请新疆空管局情报中心开展CNMS系统业务培训_民航资源网,2021-08-16--16-02-16,为了进一步提高航空情报员及业务技能，<b>新疆</b>机场集团空管业务部在保证疫情防控的前提下，于2021年8月16日邀请<b>新疆</b>空管局情报中心教员组织开展&nbsp;...,图片新疆机场集团空管业务部邀请新疆空管局---2021-08-16--16-02-16.html
https://u.jd.com/QHuRq4j,新疆第一窖古城白酒新疆白酒整箱特价纯粮食白酒500ml6整箱装高度白酒送礼袋52浓香型古城老窖,2021-08-16--15-40-12,<b>新疆</b>第一窖古城白酒<b>新疆</b>白酒整箱特价纯粮食白酒500ml*6整箱装高度白酒送礼袋52°浓香型古城老窖整箱500ml*6图片、价格、品牌样样齐全！【京东&nbsp;...,新疆第一窖古城白酒新疆白酒整箱特价纯粮食---2021-08-16--15-40-12.html
http://m.ce.cn/bwzg/202108/16/t20210816_36812629.shtml,新疆阿拉山口市新增3例无症状感染者_中国经济网,2021-08-16--14-44-19,经济日报-中国经济网8月16日讯（记者乔文汇通讯员杨露露）8月15日，<b>新疆</b>博尔塔拉蒙古自治州阿拉山口市口岸地区在三天1次常规核酸检测中，发现3&nbsp;...,新疆阿拉山口市新增3例无症状感染者_中国---2021-08-16--14-44-19.html
http://hk.jrj.com.cn/2021/08/16223833262942.shtml,拉夏贝尔06116收到乌鲁木齐中院出具的执行裁定书,2021-08-16--14-37-30,智通财经APP讯，拉夏贝尔(06116)发布公告，该公司于2021年1月18日收到<b>新疆</b>维吾尔自治区乌鲁木齐市中级人民法院(2021)新01民初27号《&nbsp;...,拉夏贝尔06116收到乌鲁木齐中院出具的---2021-08-16--14-37-30.html
https://finance.sina.com.cn/stock/hkstock/ggscyd/2021-08-16/doc-ikqciyzm1838673.shtml,拉夏贝尔06116收到乌鲁木齐中院出具的执行裁定书,2021-08-16--14-37-30,公司于2021年8月16日收到乌鲁木齐中院发来的原告与公司、<b>新疆</b>通融、拉夏太仓、上海微乐及邢加兴先生委托贷款合同纠纷案的相关执行裁定书。根据&nbsp;...,拉夏贝尔06116收到乌鲁木齐中院出具的---2021-08-16--14-37-30.html
http://china.cnr.cn/gdgg/20210816/t20210816_525567081.shtml,恐龙家族现新成员中国丝路巨龙和新疆哈密巨龙它们长什么样,2021-08-16--14-03-45,央广网北京8月16日消息据中央广播电视总台中国之声《新闻超链接》报道，《自然》旗下的学术期刊《科学报告》最近在线发表了关于<b>新疆</b>早白垩世翼龙&nbsp;...,恐龙家族现新成员中国丝路巨龙和新疆哈密巨---2021-08-16--14-03-45.html
https://xjrsjxjy.com/,新疆继续教育,2021-08-16--14-03-28,<b>新疆</b>继续教育. 获取Microsoft Silverlight.,新疆继续教育---2021-08-16--14-03-28.html
http://www.ce.cn/xwzx/gnsz/gdxw/202108/16/t20210816_36812672.shtml,能源纺织文创西部地区都招哪些人,2021-08-16--12-00-00,<b>新疆</b>深植纺织服装产业，组织<b>新疆</b>天山纺织服装公司、丝路金通纺织公司、康辉生态家纺公司、际华七五五五职业装公司等143家企业提供岗位1.3万个，&nbsp;...,能源纺织文创西部地区都招哪些人---2021-08-16--12-00-00.html
http://www.chinanews.com/sh/2021/08-16/9544678.shtml,新疆阿勒泰牧民迎来打草季全程机械化助力牧民收割,2021-08-16--11-48-45,中新网乌鲁木齐8月16日电(刘世恒藏哈尔·金额斯别)8月中旬以来，<b>新疆</b>阿勒泰各地天然草场迎来了丰收季，农牧民们开始紧锣密鼓地收割储备越冬草料，&nbsp;...,新疆阿勒泰牧民迎来打草季全程机械化助力牧---2021-08-16--11-48-45.html
http://www.cneb.gov.cn/2021/08/16/ARTI1629108365885488.shtml,新疆阿克苏地区发布冰雹橙色预警_国家应急广播网,2021-08-16--11-04-04,<b>新疆</b>阿克苏地区发布冰雹橙色预警. 2021-08-16 18:06 来源：中国气象局网站. 阿克苏地区气象台2021年8月16日17时55分发布冰雹橙色预警信号：预计&nbsp;...,新疆阿克苏地区发布冰雹橙色预警_国家应急---2021-08-16--11-04-04.html
http://www.ccgp-xinjiang.gov.cn/ZcyAnnouncement/ZcyAnnouncement4/ZcyAnnouncement3004//VyTCkXo8LvHu3iTCO5JFQ==.html,新疆天壹中山工程咨询有限公司关于新疆维吾尔自治区自然资源数据汇聚交换分析系统的中标结果公告,2021-08-16--10-59-09,"1, <b>新疆</b>维吾尔自治区自然资源数据汇聚交换分析系统, 详见招标文件, 不限, 批次, 1397800元, 北京数慧时空信息技术有限公司, 北京市海淀区苏州街3号三&nbsp;...",新疆天壹中山工程咨询有限公司关于新疆维吾---2021-08-16--10-59-09.html
http://news.weather.com.cn/2021/08/3487323.shtml,山洪黄色预警四川新疆局地发生山洪灾害可能性较大资讯,2021-08-16--10-45-47,预计，8月16日20时至8月17日20时，浙江西部、江西东北部、四川中部、云南东北部、西藏东南部、<b>新疆</b>西北部等地部分地区可能发生山洪灾害（蓝色&nbsp;...,山洪黄色预警四川新疆局地发生山洪灾害可能---2021-08-16--10-45-47.html
http://paper.cnstock.com/html/2021-08/17/content_1508435.htm,新疆拉夏贝尔服饰股份有限公司关于公司及全资子公司涉及诉讼的进展公告,2021-08-16--10-30-00,公司将持续关注后续进展情况，并按照有关规定及时履行信息披露义务，敬请广大投资者注意投资风险。 公司于2021年8月16日收到<b>新疆</b>乌鲁木齐市中级&nbsp;...,新疆拉夏贝尔服饰股份有限公司关于公司及全---2021-08-16--10-30-00.html
https://news.hangzhou.com.cn/gnxw/content/2021-08/16/content_8033111.htm,山洪黄色预警四川新疆局地发生山洪灾害可能性较大,2021-08-16--10-18-45,预计，8月16日20时至8月17日20时，浙江西部、江西东北部、四川中部、云南东北部、西藏东南部、<b>新疆</b>西北部等地部分地区可能发生山洪灾害（蓝色&nbsp;...,山洪黄色预警四川新疆局地发生山洪灾害可能---2021-08-16--10-18-45.html
